,text,label
212,The system shall provide Multi-threading and Load Balancing.The system shall provide multi-threading technology as well as load balancing to overcome data load spikes and traffic .,PERFORMANCE
213,The system shall process messages fast.The system shall have a maximum message processing time of fast,PERFORMANCE
214,The system shall poll the system for messages every second.The system shall poll the system for new messages at a maximum of alltimes .,PERFORMANCE
215,The system shall provide Dynamic Change Support and Transparent resource addition.The system shall support Transparent Resource addition and Dynamic Change support to provide scalability and avoid service interruptions of more than 1 day .,PERFORMANCE
216,The system shall be available alltimes . Rationale : To avoid service interruption during busiest user service response periods . The system shall be available . alltimes for regular business days .,AVAILABILITY
217,The system shall be robust.The system shall have fault avoidance based on standards adoption .,FAULT TOLERANCE
218,The system shall be robust with fault tolerance.The system shall have fault tolerance by using recovery technique compensatory transaction and routing around failures .,FAULT TOLERANCE
219,The system shall be able to process all transactions.The system shall process minimum of transactions per year .,SCALABILITY
220,The system shall continue to operate during upgrade change or new resource addition.The system shall be able to continue to operate with no interruption in service due to new resource additions .,MAINTAINABILITY
221,The system shall be updated on a regular basis.The system will have a new major feature introduced alltimes and alltimes maintenance releases alltimes .,MAINTAINABILITY
222,The system shall operate with every platform.The system shall accommodate any new technology without any change in its architecture .,MAINTAINABILITY
223,The system shall have security.The system shall provide authentication and authorization .,SECURITY
224,The system shall information Security . The system shall enable privacy by encryption WS-Security and Integrity Checking .,SECURITY
225,The system shall have audit capabilities.The system shall store messages for a minimum of one year for audit and transaction tracking purposes .,SECURITY
226,The system must use a point and click interface . all of all selection and navigation functionality must be able to be activated/selected by either a mouse or a keyboard,USABILITY
227,The interface shall be easy to use . most of user should be able to successfully use the system to generate a report on their first use . The interface should adhere to usability standards .,USABILITY
228,Reports must be easy to generate . Reports must be generated within button click and exported within button click after selecting the report,USABILITY
229,A user shall be able to use the system without instruction after a short amount of time . After use a user should understand and remember most of the system usage and navigation .,USABILITY
230,All user shall receive training before the system is deployed . training session will be held for all of user before system deployment based on a user being available,USABILITY
231,The system shall use appropriate nomenclature and terminology as defined by the user . All interfaces and reports will undergo usability tests by user .,USABILITY
232,The system shall be available at all times as long as 's internal intranet W3 is accessible . The system will be available most of the time 's internal intranet W3 is available .,AVAILABILITY
233,The system shall have the ability to connect other designated databases currently not included in the system .,SCALABILITY
234,The system shall have the ability to include data for regions outside the and be accessed by user outside of the if approved by management .,SCALABILITY
235,The system must run queries to the databases once again on a specified day to update the available data available to users . Queries must be made to external databases for data refresh once a week .,MAINTAINABILITY
236,All changes updates and additions to the system shall be updated in the Developer and User Guides . Every change must be reflected in system documentation,MAINTAINABILITY
237,The system shall only be accessed by authorized user using their intranet user name and password .,SECURITY
238,The system shall not allow automatic logins by any user . Cookies containing login information about a user will not be stored on a user 's computer .,SECURITY
239,Each user will need to use a username and password in order to be authenticated to reach the user 's page,SECURITY
240,The user will be the only authorized user per league to adjust league settings .,SECURITY
241,A new user shall be able to navigate through the league and team pages fast of reaching the start-up page .,USABILITY
242,user shall be able to reach the ' add ' ' drop ' and ' trade user ' pages with click from the team owner 's page .,USABILITY
243,user shall be able to view at least user statistics and points on each page .,USABILITY
244,The system shall ask the user to confirm dropping a user or trading a user before performing the action .,USABILITY
245,The system shall be able to complete every user transaction within fourth of a second of receiving the request over the network .,PERFORMANCE
246,The system shall have a downtime of at most 10 minutes per year .,AVAILABILITY
247,system updates shall occur between on Wednesday during the middle of the season .,MAINTAINABILITY
248,New system version releases shall be released at the beginning of each season .,MAINTAINABILITY
249,The system should be available alltimes especially during the budgeting period . The system shall be available alltimes all year and most during the budgeting period . little of the time the system will become available within 1 hour of the time that the situation is reported .,AVAILABILITY
250,Changes to revenue and expense formulae must be applied to the system alltimes prior to the budgeting process start . Revenue and expense formulae will be updated within one week of their receipt after which 2 weeks will be allotted to testing of the budget calculations to be conducted jointly by the project development team and .,MAINTAINABILITY
251,New branches/complexes/districts / regions and revenue/expense accounts added to the user must be reflected in the system . all of the entities mentioned above available as of October month-end will be loaded into the system prior to the budget start process .,MAINTAINABILITY
252,Only authorized user shall access the system . ONLY user that exist in the system with the system assigned to their role s shall access the system and use it .,SECURITY
253,user access should be limited to the permissions granted to their role s Each level in the PCG hierarchy will be assigned a role and user willuserssigned to these roles . Access to functionality within system on the privileges/permission assigned to the role . .,SECURITY
254,The user should be able to easily use the system to successfully complete their budgets within the stipulated time for completion . With a week of training prior to product implementation most of the user shall complete their budgets within the stipulated time .,USABILITY
255,The system interface should be fast . The response time of the system interface should not exceed fast alltimes . For little of the time the response time should fast.fast .,PERFORMANCE
